{"schemaVersion":"1","sourcePath":"analysis/gold/ingest/source_minimal.txt","enabled":true,"offline":true,"envFile":"src/test/resources/enrichment/offline.env","effectiveTextChanged":false,"suggestedStepsCount":0,"notes":[],"providers":[{"name":"groq","configured":true,"attempted":false,"applied":false,"status":"skipped","detail":"offline_mode"},{"name":"ocr_space","configured":true,"attempted":false,"applied":false,"status":"skipped","detail":"offline_mode"},{"name":"deepl","configured":true,"attempted":false,"applied":false,"status":"skipped","detail":"offline_mode"},{"name":"youtube","configured":true,"attempted":false,"applied":false,"status":"skipped","detail":"offline_mode"}]}
